{
  "schema_version": "1.0.0",
  "document_type": "timed_lyrics",
  "release_key": "windows-still-lit",
  "track_key": "08-windows-still-lit",
  "title": "Windows Still Lit",
  "artist": "Cairn",
  "language": "en",
  "time_unit": "milliseconds",
  "sample_rate": 44100,
  "duration_samples": 8640836,
  "duration_ms": 195937,
  "recording": {
    "id": "sha256:4959663a2c908a7faffcc0add044c2d9ebf288e537dd431559aa810fc0623d16",
    "revision": 1,
    "canonical_format": "wav",
    "audio_assets": [
      {
        "format": "wav",
        "album_relative_path": "wav/08-windows-still-lit.wav",
        "sha256": "4959663a2c908a7faffcc0add044c2d9ebf288e537dd431559aa810fc0623d16"
      },
      {
        "format": "mp3",
        "album_relative_path": "mp3/08-windows-still-lit.mp3",
        "sha256": "a7195fe4a0023ab0081b16d77ffc3269e53ea5a1f9ffec95bd8ab1cb3382b33d"
      }
    ]
  },
  "alignment": {
    "method": "composer_authored_render_events",
    "audio_zero": "first decoded PCM sample",
    "render_offset_ms": 40,
    "intervals": "start inclusive; end exclusive",
    "vocal_release_ms": 12,
    "reverb_tails_excluded": true,
    "manually_listening_verified": false
  },
  "cues": [
    {
      "id": "08-windows-still-lit/lead/013",
      "role": "lead",
      "text": "Windows still lit",
      "start_sample": 67914,
      "end_sample": 266364,
      "start_ms": 1540,
      "end_ms": 6040,
      "words": [
        {
          "id": "08-windows-still-lit/word/0062",
          "text": "Windows",
          "role": "lead",
          "note_midi": 72,
          "start_sample": 67914,
          "end_sample": 127869,
          "start_ms": 1540,
          "end_ms": 2900,
          "phonemes": [
            {
              "symbol": "W",
              "start_sample": 67914,
              "end_sample": 71398,
              "start_ms": 1540,
              "end_ms": 1619
            },
            {
              "symbol": "IH",
              "start_sample": 70781,
              "end_sample": 95753,
              "start_ms": 1605,
              "end_ms": 2171
            },
            {
              "symbol": "N",
              "start_sample": 95135,
              "end_sample": 98619,
              "start_ms": 2157,
              "end_ms": 2236
            },
            {
              "symbol": "D",
              "start_sample": 98002,
              "end_sample": 100648,
              "start_ms": 2222,
              "end_ms": 2282
            },
            {
              "symbol": "OW",
              "start_sample": 100030,
              "end_sample": 125002,
              "start_ms": 2268,
              "end_ms": 2835
            },
            {
              "symbol": "Z",
              "start_sample": 124385,
              "end_sample": 127869,
              "start_ms": 2821,
              "end_ms": 2900
            }
          ]
        },
        {
          "id": "08-windows-still-lit/word/0063",
          "text": "still",
          "role": "lead",
          "note_midi": 69,
          "start_sample": 128464,
          "end_sample": 188419,
          "start_ms": 2913,
          "end_ms": 4273,
          "phonemes": [
            {
              "symbol": "S",
              "start_sample": 128464,
              "end_sample": 131948,
              "start_ms": 2913,
              "end_ms": 2992
            },
            {
              "symbol": "T",
              "start_sample": 131331,
              "end_sample": 133977,
              "start_ms": 2978,
              "end_ms": 3038
            },
            {
              "symbol": "IH",
              "start_sample": 133359,
              "end_sample": 185553,
              "start_ms": 3024,
              "end_ms": 4208
            },
            {
              "symbol": "L",
              "start_sample": 184935,
              "end_sample": 188419,
              "start_ms": 4194,
              "end_ms": 4273
            }
          ]
        },
        {
          "id": "08-windows-still-lit/word/0064",
          "text": "lit",
          "role": "lead",
          "note_midi": 65,
          "start_sample": 189014,
          "end_sample": 258051,
          "start_ms": 4286,
          "end_ms": 5851,
          "phonemes": [
            {
              "symbol": "L",
              "start_sample": 189014,
              "end_sample": 192498,
              "start_ms": 4286,
              "end_ms": 4365
            },
            {
              "symbol": "IH",
              "start_sample": 191880,
              "end_sample": 256023,
              "start_ms": 4351,
              "end_ms": 5806
            },
            {
              "symbol": "T",
              "start_sample": 255405,
              "end_sample": 258051,
              "start_ms": 5791,
              "end_ms": 5851
            }
          ]
        }
      ]
    },
    {
      "id": "08-windows-still-lit/lead/001",
      "role": "lead",
      "text": "Windows still lit",
      "start_sample": 1412964,
      "end_sample": 1677564,
      "start_ms": 32040,
      "end_ms": 38040,
      "words": [
        {
          "id": "08-windows-still-lit/word/0001",
          "text": "Windows",
          "role": "lead",
          "note_midi": 72,
          "start_sample": 1412964,
          "end_sample": 1493919,
          "start_ms": 32040,
          "end_ms": 33876,
          "phonemes": [
            {
              "symbol": "W",
              "start_sample": 1412964,
              "end_sample": 1416448,
              "start_ms": 32040,
              "end_ms": 32119
            },
            {
              "symbol": "IH",
              "start_sample": 1415830,
              "end_sample": 1451302,
              "start_ms": 32105,
              "end_ms": 32909
            },
            {
              "symbol": "N",
              "start_sample": 1450685,
              "end_sample": 1454169,
              "start_ms": 32895,
              "end_ms": 32974
            },
            {
              "symbol": "D",
              "start_sample": 1453552,
              "end_sample": 1456198,
              "start_ms": 32960,
              "end_ms": 33020
            },
            {
              "symbol": "OW",
              "start_sample": 1455580,
              "end_sample": 1491052,
              "start_ms": 33006,
              "end_ms": 33811
            },
            {
              "symbol": "Z",
              "start_sample": 1490435,
              "end_sample": 1493919,
              "start_ms": 33797,
              "end_ms": 33876
            }
          ]
        },
        {
          "id": "08-windows-still-lit/word/0002",
          "text": "still",
          "role": "lead",
          "note_midi": 69,
          "start_sample": 1494514,
          "end_sample": 1575469,
          "start_ms": 33889,
          "end_ms": 35725,
          "phonemes": [
            {
              "symbol": "S",
              "start_sample": 1494514,
              "end_sample": 1497998,
              "start_ms": 33889,
              "end_ms": 33968
            },
            {
              "symbol": "T",
              "start_sample": 1497381,
              "end_sample": 1500027,
              "start_ms": 33954,
              "end_ms": 34014
            },
            {
              "symbol": "IH",
              "start_sample": 1499409,
              "end_sample": 1572603,
              "start_ms": 34000,
              "end_ms": 35660
            },
            {
              "symbol": "L",
              "start_sample": 1571985,
              "end_sample": 1575469,
              "start_ms": 35646,
              "end_ms": 35725
            }
          ]
        },
        {
          "id": "08-windows-still-lit/word/0003",
          "text": "lit",
          "role": "lead",
          "note_midi": 67,
          "start_sample": 1576064,
          "end_sample": 1669251,
          "start_ms": 35738,
          "end_ms": 37851,
          "phonemes": [
            {
              "symbol": "L",
              "start_sample": 1576064,
              "end_sample": 1579548,
              "start_ms": 35738,
              "end_ms": 35817
            },
            {
              "symbol": "IH",
              "start_sample": 1578930,
              "end_sample": 1667223,
              "start_ms": 35803,
              "end_ms": 37806
            },
            {
              "symbol": "T",
              "start_sample": 1666605,
              "end_sample": 1669251,
              "start_ms": 37791,
              "end_ms": 37851
            }
          ]
        }
      ]
    },
    {
      "id": "08-windows-still-lit/lead/002",
      "role": "lead",
      "text": "The street has gone quiet",
      "start_sample": 1677564,
      "end_sample": 1942164,
      "start_ms": 38040,
      "end_ms": 44040,
      "words": [
        {
          "id": "08-windows-still-lit/word/0004",
          "text": "The",
          "role": "lead",
          "note_midi": 65,
          "start_sample": 1677564,
          "end_sample": 1712401,
          "start_ms": 38040,
          "end_ms": 38830,
          "phonemes": [
            {
              "symbol": "DH",
              "start_sample": 1677564,
              "end_sample": 1681048,
              "start_ms": 38040,
              "end_ms": 38119
            },
            {
              "symbol": "AX",
              "start_sample": 1680430,
              "end_sample": 1712401,
              "start_ms": 38105,
              "end_ms": 38830
            }
          ]
        },
        {
          "id": "08-windows-still-lit/word/0005",
          "text": "street",
          "role": "lead",
          "note_midi": 67,
          "start_sample": 1712996,
          "end_sample": 1774014,
          "start_ms": 38843,
          "end_ms": 40227,
          "phonemes": [
            {
              "symbol": "S",
              "start_sample": 1712996,
              "end_sample": 1717230,
              "start_ms": 38843,